{
  "$schema": "https://json-schema.org/draft/2020-12/schema",
  "$id": "https://spaceleoch.github.io/ai-signal-brief/schemas/run.schema.json",
  "title": "AI Signal Brief Run Metadata",
  "type": "object",
  "additionalProperties": false,
  "required": [
    "schema_version",
    "run_id",
    "started_at",
    "timezone",
    "status",
    "mode",
    "environment",
    "artifacts",
    "delivery",
    "warnings",
    "errors"
  ],
  "properties": {
    "schema_version": { "type": "string", "pattern": "^[0-9]+\\.[0-9]+\\.[0-9]+$" },
    "run_id": { "type": "string", "minLength": 1 },
    "started_at": { "type": "string", "format": "date-time" },
    "ended_at": { "type": ["string", "null"], "format": "date-time" },
    "timezone": { "type": "string", "minLength": 1 },
    "status": { "type": "string", "enum": ["success", "partial", "failed", "dry_run"] },
    "mode": { "type": "string", "enum": ["manual", "scheduled", "test"] },
    "environment": { "type": "string", "enum": ["local", "github_actions", "other"] },
    "artifacts": {
      "type": "array",
      "items": {
        "type": "object",
        "additionalProperties": false,
        "required": ["kind", "path"],
        "properties": {
          "kind": { "type": "string" },
          "path": { "type": "string" },
          "sha256": { "type": "string" }
        }
      }
    },
    "delivery": {
      "type": "object",
      "additionalProperties": true
    },
    "warnings": { "type": "array", "items": { "type": "string" } },
    "errors": { "type": "array", "items": { "type": "string" } }
  }
}