{
  "schema_version": "1.0.0",
  "run_id": "2026-06-24T04-00-00+08-00",
  "started_at": "2026-06-24T04:00:00+08:00",
  "ended_at": "2026-06-24T04:01:00+08:00",
  "timezone": "Asia/Kuala_Lumpur",
  "status": "success",
  "mode": "manual",
  "environment": "local",
  "artifacts": [
    {
      "kind": "report_json",
      "path": "examples/report.example.json"
    }
  ],
  "delivery": {
    "telegram": {
      "enabled": false,
      "status": "skipped"
    }
  },
  "warnings": [],
  "errors": []
}